,number,value,datetime_start,datetime_complete,duration,params_activation_fn,params_batch_size,params_clip_range,params_ent_coef,params_gae_lambda,params_gamma,params_learning_rate,params_log_std_init,params_max_grad_norm,params_n_epochs,params_n_steps,params_net_arch,params_sde_sample_freq,params_vf_coef,state
94,94,,2024-04-16 08:55:22.419858,2024-04-16 09:04:01.059976,0 days 00:08:38.640118,tanh,512,0.3,0.07716835973522046,0.9,0.98,0.8866213213613473,-3.5383953900686573,0.6,1,512,small,64,0.9093677524775545,PRUNED
95,95,97.1445667,2024-04-16 08:57:00.682723,2024-04-16 09:12:43.841048,0 days 00:15:43.158325,tanh,16,0.4,0.0010438981490218553,0.98,0.9,0.018463642582058366,-0.8011637433759049,2.0,1,2048,small,32,0.28441194695406696,COMPLETE
96,96,2.6067412000000005,2024-04-16 08:59:13.434834,2024-04-16 09:12:33.086787,0 days 00:13:19.651953,tanh,32,0.4,0.02326850415402661,0.98,0.999,0.026641214736359088,-0.057417110064395815,2.0,1,2048,small,256,0.5905899355893468,PRUNED
97,97,45.163698499999995,2024-04-16 09:02:18.881381,2024-04-16 09:14:11.203406,0 days 00:11:52.322025,tanh,32,0.2,0.013173746745109524,0.9,0.99,0.00766483883867808,-0.970559038759921,1.0,1,128,medium,16,0.5499959603802173,PRUNED
98,98,35.0745429,2024-04-16 09:04:01.062068,2024-04-16 09:13:59.879611,0 days 00:09:58.817543,tanh,512,0.4,0.00015904472717729907,0.8,0.98,0.008401158861970173,0.43049685161680196,2.0,1,2048,tiny,-1,0.16537033614570718,PRUNED
99,99,-5.7558827999999975,2024-04-16 09:07:44.004652,2024-04-16 09:14:34.109705,0 days 00:06:50.105053,tanh,512,0.4,1.8662545045389002e-05,0.98,0.999,0.01773613024039444,0.9400165648341503,2.0,1,1024,tiny,-1,0.1512794054709239,PRUNED
