,number,value,datetime_start,datetime_complete,duration,params_activation_fn,params_batch_size,params_clip_range,params_ent_coef,params_gae_lambda,params_gamma,params_learning_rate,params_log_std_init,params_max_grad_norm,params_n_epochs,params_n_steps,params_net_arch,params_sde_sample_freq,params_vf_coef,state
94,94,43.9407169,2024-04-18 07:38:02.874990,2024-04-18 07:49:33.415959,0 days 00:11:30.540969,tanh,256,0.2,0.0013585892642671259,1.0,0.999,0.0016572762416336712,-1.8972040741694736,0.3,20,256,tiny,256,0.835654372088874,PRUNED
95,95,30.360794700000003,2024-04-18 07:41:52.014284,2024-04-18 07:54:42.101964,0 days 00:12:50.087680,tanh,256,0.2,0.0009176540654225478,0.8,0.999,0.004372526094605108,-0.47063566860933403,0.3,20,128,tiny,8,0.3619666791335673,PRUNED
96,96,9.508857800000001,2024-04-18 07:44:24.043642,2024-04-18 07:54:47.162429,0 days 00:10:23.118787,tanh,256,0.2,0.0016810270873691365,1.0,0.999,0.007837917410372458,-2.290014730605409,0.3,20,1024,tiny,8,0.7497847675658499,PRUNED
97,97,9.178810299999999,2024-04-18 07:45:33.097939,2024-04-18 07:55:23.490316,0 days 00:09:50.392377,tanh,256,0.2,0.004413461817897744,1.0,0.999,0.02234756971720007,-0.0275954327262532,0.3,20,256,tiny,64,0.8636629180732324,PRUNED
98,98,24.146676899999996,2024-04-18 07:46:42.819241,2024-04-18 07:56:04.954410,0 days 00:09:22.135169,tanh,256,0.2,0.001212844756255925,1.0,0.999,0.0031497937138764377,-0.34625888999687804,5.0,20,256,medium,8,0.6779776591788618,PRUNED
99,99,7.0139979,2024-04-18 07:49:22.482181,2024-04-18 07:59:54.839115,0 days 00:10:32.356934,relu,16,0.4,8.887849225932701e-05,0.9,0.999,0.10393252255850542,0.954308026615051,0.6,10,8,tiny,256,0.7453496744919669,PRUNED
