,number,value,datetime_start,datetime_complete,duration,params_activation_fn,params_batch_size,params_clip_range,params_ent_coef,params_gae_lambda,params_gamma,params_learning_rate,params_log_std_init,params_max_grad_norm,params_n_epochs,params_n_steps,params_net_arch,params_sde_sample_freq,params_vf_coef,state
93,93,146.10773360000002,2024-04-18 11:52:43.907091,2024-04-18 12:05:44.467253,0 days 00:13:00.560162,relu,256,0.4,0.0022133342468620082,0.8,0.999,0.0012263896177588788,0.781480239865019,0.6,10,64,medium,16,0.21994972559649117,COMPLETE
94,94,,2024-04-18 11:56:26.182557,2024-04-18 12:09:16.097887,0 days 00:12:49.915330,relu,8,0.4,1.4952091719681395e-07,0.92,0.98,0.5442524660373741,0.42122804330078467,0.7,10,1024,small,64,0.2031169547049352,PRUNED
95,95,115.1157367,2024-04-18 11:57:19.742298,2024-04-18 12:15:53.992505,0 days 00:18:34.250207,tanh,256,0.3,0.002132992092834091,0.9,0.9,0.001106456794972489,-0.4310797448135618,1.0,20,32,tiny,16,0.6386577399143945,PRUNED
96,96,109.6483016,2024-04-18 12:00:38.581555,2024-04-18 12:15:04.061204,0 days 00:14:25.479649,tanh,256,0.1,0.02126568819446057,0.8,0.95,5.7038608968473696e-05,-0.37740231124544055,2.0,20,64,small,-1,0.6755941602936961,PRUNED
97,97,122.22021380000001,2024-04-18 12:02:33.731651,2024-04-18 12:21:59.403203,0 days 00:19:25.671552,tanh,8,0.4,1.521935327846396e-08,0.92,0.9,0.005469070452309068,-0.9940234351570082,0.9,10,64,small,32,0.0902871566477918,PRUNED
98,98,118.40792300000001,2024-04-18 12:05:44.468251,2024-04-18 12:15:31.004548,0 days 00:09:46.536297,tanh,64,0.4,1.2977029531645615e-08,0.92,0.9,0.03259814829796655,0.9655787436181463,0.9,10,64,small,32,0.42208502569259787,PRUNED
99,99,128.311663,2024-04-18 12:08:11.751334,2024-04-18 12:26:02.188591,0 days 00:17:50.437257,tanh,8,0.4,1.1855534901307353e-08,0.92,0.9,0.0020563171790374986,-0.4307250174731564,0.9,20,512,small,32,0.00892300499553958,PRUNED
