,number,value,datetime_start,datetime_complete,duration,params_activation_fn,params_batch_size,params_clip_range,params_ent_coef,params_gae_lambda,params_gamma,params_learning_rate,params_log_std_init,params_max_grad_norm,params_n_epochs,params_n_steps,params_net_arch,params_sde_sample_freq,params_vf_coef,state
93,93,5.3600095,2024-04-16 13:13:46.188407,2024-04-16 13:23:06.208575,0 days 00:09:20.020168,relu,512,0.2,0.011213407965967705,0.99,0.95,0.18951183190864376,-0.09127598453773822,0.3,5,2048,tiny,256,0.7822566773458568,PRUNED
94,94,118.59766929999998,2024-04-16 13:14:25.829644,2024-04-16 13:24:13.170516,0 days 00:09:47.340872,relu,512,0.4,0.0020154767799458323,0.8,0.95,9.541712911409847e-05,-0.7568948742728243,0.3,5,512,tiny,64,0.22897210425253803,PRUNED
95,95,22.445590900000003,2024-04-16 13:17:51.593911,2024-04-16 13:34:39.374486,0 days 00:16:47.780575,relu,16,0.4,0.005825943235983655,0.8,0.999,0.004304270106955448,-0.13403680978792928,0.3,5,128,tiny,64,0.6184270311207658,PRUNED
96,96,104.61015760000001,2024-04-16 13:19:02.673032,2024-04-16 13:28:51.052227,0 days 00:09:48.379195,relu,512,0.4,0.0025619663095231195,0.99,0.999,0.0024070394420070995,-0.7520274670459072,0.3,5,1024,tiny,64,0.2215818994820033,PRUNED
97,97,113.6529821,2024-04-16 13:23:06.209572,2024-04-16 13:39:05.308290,0 days 00:15:59.098718,relu,64,0.4,0.0011227625275759844,0.8,0.95,0.0030636692482412103,0.2658791930472445,0.3,5,8,tiny,128,0.28929611790765253,PRUNED
98,98,77.03250929999999,2024-04-16 13:23:33.373914,2024-04-16 13:39:08.407999,0 days 00:15:35.034085,relu,512,0.4,0.007417387787063281,0.8,0.9,0.00022884343084805225,0.6536584577624832,0.3,5,8,tiny,64,0.5092365571523074,PRUNED
99,99,142.3876392,2024-04-16 13:24:13.171514,2024-04-16 13:35:31.595632,0 days 00:11:18.424118,relu,512,0.4,0.0004031633981001788,0.8,0.95,0.00010367062114027488,0.4920318373055154,0.5,20,128,tiny,32,0.4043007665742667,COMPLETE
