,number,value,datetime_start,datetime_complete,duration,params_batch_size,params_buffer_size,params_gamma,params_learning_rate,params_learning_starts,params_log_std_init,params_net_arch,params_tau,params_train_freq,state
0,0,145.8091516,2024-04-14 22:15:44.753637,2024-04-14 23:06:21.826908,0 days 00:50:37.073271,32,100000,0.9,0.023163881866106063,10000,-2.2974513381594823,medium,0.02,32,COMPLETE
1,1,119.34161750000001,2024-04-14 22:15:44.755613,2024-04-14 23:09:17.509330,0 days 00:53:32.753717,128,10000,0.98,0.0002489047592508931,10000,0.5029215738668578,medium,0.005,256,COMPLETE
2,2,133.3055635,2024-04-14 22:15:44.756668,2024-04-14 23:02:45.626151,0 days 00:47:00.869483,16,100000,0.999,0.00015876938578423297,10000,-0.8563269902348676,medium,0.02,4,COMPLETE
3,3,129.5854112,2024-04-14 22:15:44.757666,2024-04-14 23:16:40.793853,0 days 01:00:56.036187,16,1000000,0.995,0.027613551011310536,1000,-2.8702874802312137,medium,0.08,1,COMPLETE
4,4,,2024-04-14 22:15:44.758664,2024-04-14 22:17:34.105879,0 days 00:01:49.347215,1024,10000,0.999,0.8100929355055757,10000,-0.4872648316680275,small,0.01,16,PRUNED
5,5,114.1380786,2024-04-14 22:15:44.759661,2024-04-14 23:21:14.112951,0 days 01:05:29.353290,64,10000,0.9999,0.026271629585747587,1000,-3.2573174563542753,medium,0.08,64,COMPLETE
6,6,,2024-04-14 22:15:44.762653,2024-04-14 22:18:30.700404,0 days 00:02:45.937751,256,100000,0.999,0.49066872897030395,20000,-3.56358392505231,big,0.05,8,PRUNED
7,7,114.82798970000002,2024-04-14 22:15:44.765644,2024-04-14 23:03:51.194812,0 days 00:48:06.429168,128,100000,0.999,0.002600822153742698,20000,0.3990604705016336,big,0.01,32,COMPLETE
8,8,119.60648739999999,2024-04-14 22:17:34.106877,2024-04-14 23:06:50.271015,0 days 00:49:16.164138,256,100000,0.99,0.00022584503007472368,0,-0.4841463172201501,small,0.001,256,COMPLETE
9,9,111.38753550000001,2024-04-14 22:18:30.701401,2024-04-15 00:28:54.519665,0 days 02:10:23.818264,2048,10000,0.995,6.0102400964579e-05,1000,-1.2358137274898233,big,0.001,512,PRUNED
10,10,,2024-04-14 23:02:45.628145,2024-04-14 23:03:49.168233,0 days 00:01:03.540088,16,10000,0.9,0.12932012131797044,10000,0.46566696062962265,medium,0.005,4,PRUNED
11,11,134.5923215,2024-04-14 23:03:49.169232,2024-04-14 23:55:33.882899,0 days 00:51:44.713667,128,1000000,0.95,5.415020643183913e-05,0,0.6234854618108434,small,0.01,64,COMPLETE
12,12,112.5829401,2024-04-14 23:03:51.195809,2024-04-15 01:02:28.809616,0 days 01:58:37.613807,2048,10000,0.9999,0.0003737681702747156,1000,0.6737665001066926,medium,0.005,256,PRUNED
13,13,127.69925539999997,2024-04-14 23:06:21.827905,2024-04-15 00:21:32.871081,0 days 01:15:11.043176,32,10000,0.9,0.0006072911423710575,1000,-0.7463026102201806,big,0.08,32,COMPLETE
14,14,126.18889880000002,2024-04-14 23:06:50.273009,2024-04-15 00:11:38.729955,0 days 01:04:48.456946,1024,10000,0.9,0.0006094982491636641,10000,-3.0677664937319697,small,0.01,4,COMPLETE
15,15,104.3415747,2024-04-14 23:09:17.510327,2024-04-15 00:00:36.302717,0 days 00:51:18.792390,32,10000,0.999,0.00723753167277975,10000,0.2894192513257181,medium,0.05,8,COMPLETE
16,16,119.68368419999999,2024-04-14 23:16:40.794851,2024-04-14 23:44:04.294421,0 days 00:27:23.499570,16,100000,0.9,0.007493341151841337,10000,-0.7567591341178668,small,0.05,64,COMPLETE
17,17,121.3235678,2024-04-14 23:21:14.114946,2024-04-15 00:22:48.698104,0 days 01:01:34.583158,32,100000,0.9,0.012598272363641005,10000,-1.7478443496973202,big,0.05,32,PRUNED
18,18,95.4291695,2024-04-14 23:44:04.295419,2024-04-15 00:44:47.324607,0 days 01:00:43.029188,16,100000,0.999,2.5186327784532016e-05,1000,-0.725403737045736,medium,0.02,4,PRUNED
19,19,111.2366677,2024-04-14 23:55:33.883896,2024-04-15 00:50:15.280828,0 days 00:54:41.396932,128,1000000,0.95,0.0007747051725463906,0,0.9476564018013285,small,0.01,64,PRUNED
20,20,126.3475425,2024-04-15 00:00:36.304712,2024-04-15 00:55:30.728181,0 days 00:54:54.423469,128,1000000,0.95,3.258008258380187e-05,0,-0.1493580650707227,small,0.01,64,COMPLETE
21,21,133.0426544,2024-04-15 00:11:38.730953,2024-04-15 01:05:17.006381,0 days 00:53:38.275428,128,1000000,0.95,0.00038262687949362203,0,0.8018877291536685,small,0.01,64,COMPLETE
22,22,118.04832200000001,2024-04-15 00:21:32.872078,2024-04-15 01:05:59.328180,0 days 00:44:26.456102,128,1000000,0.95,0.00011963646169686091,10000,-0.17921091069398964,small,0.01,512,PRUNED
23,23,,2024-04-15 00:22:48.699102,2024-04-15 00:23:03.976239,0 days 00:00:15.277137,128,100000,0.9,0.39152592550182014,1000,-3.0649799290500424,medium,0.02,8,PRUNED
24,24,96.3772644,2024-04-15 00:23:03.977237,2024-04-15 01:17:08.387297,0 days 00:54:04.410060,128,1000000,0.9999,3.324384269675388e-05,0,-0.5912436564412424,small,0.01,4,PRUNED
25,25,126.72720489999999,2024-04-15 00:28:54.520663,2024-04-15 01:23:29.284905,0 days 00:54:34.764242,128,1000000,0.995,0.0016744303960534062,0,0.8372112350973161,small,0.02,64,COMPLETE
26,26,138.4532079,2024-04-15 00:44:47.328624,2024-04-15 01:53:41.970415,0 days 01:08:54.641791,128,1000000,0.95,3.4906362018953424e-05,0,0.02153984044317736,big,0.02,64,COMPLETE
27,27,132.302401,2024-04-15 00:50:15.281826,2024-04-15 01:41:35.791601,0 days 00:51:20.509775,32,10000,0.9,0.023579005479038916,10000,-1.509595923931026,medium,0.02,512,COMPLETE
28,28,84.89872419999999,2024-04-15 00:55:30.729178,2024-04-15 01:47:00.360741,0 days 00:51:29.631563,64,100000,0.995,0.008874294896096898,10000,-1.8444874793877577,medium,0.02,512,PRUNED
29,29,117.263255,2024-04-15 01:02:28.810614,2024-04-15 01:50:05.170622,0 days 00:47:36.360008,16,100000,0.9,0.00018445109471787048,10000,-1.7557920543712047,medium,0.001,4,PRUNED
30,30,126.6415735,2024-04-15 01:05:17.007378,2024-04-15 01:54:11.491454,0 days 00:48:54.484076,16,100000,0.98,0.0010146448144733933,10000,-0.8132522855250277,medium,0.08,4,PRUNED
31,31,121.55082250000001,2024-04-15 01:05:59.329177,2024-04-15 01:47:41.182622,0 days 00:41:41.853445,32,100000,0.9,0.004838628607744259,10000,-3.784865218759625,small,0.02,256,PRUNED
32,32,100.405852,2024-04-15 01:17:08.388295,2024-04-15 01:54:23.982045,0 days 00:37:15.593750,16,100000,0.95,0.00025135143781651197,10000,-1.5196366858384396,small,0.02,4,PRUNED
33,33,150.93677680000002,2024-04-15 01:23:29.285901,2024-04-15 02:17:38.040250,0 days 00:54:08.754349,1024,100000,0.9,0.034036881749374616,20000,-2.2335455756766245,medium,0.08,32,COMPLETE
34,34,,2024-04-15 01:41:35.792599,2024-04-15 01:42:38.584736,0 days 00:01:02.792137,16,100000,0.9999,0.12665241087207196,10000,-1.363812539586266,medium,0.02,32,PRUNED
35,35,136.8918259,2024-04-15 01:42:38.586731,2024-04-15 02:30:57.716298,0 days 00:48:19.129567,32,100000,0.9,0.0034760790105873613,10000,-3.7781294312468816,medium,0.02,128,COMPLETE
36,36,98.54894920000001,2024-04-15 01:47:00.361738,2024-04-15 02:34:52.006101,0 days 00:47:51.644363,32,100000,0.9,0.0011553623384131608,10000,-3.3536260464926837,medium,0.08,32,PRUNED
37,37,82.466137,2024-04-15 01:47:41.183619,2024-04-15 02:40:05.040916,0 days 00:52:23.857297,32,100000,0.98,0.04555744560069541,10000,-2.050874445586023,medium,0.005,32,PRUNED
38,38,129.08091710000002,2024-04-15 01:50:05.171619,2024-04-15 02:43:17.542854,0 days 00:53:12.371235,512,10000,0.9,0.01811166946180479,20000,-3.868336807300192,medium,0.02,32,COMPLETE
39,39,105.4203095,2024-04-15 01:53:41.971413,2024-04-15 03:04:14.405391,0 days 01:10:32.433978,64,1000000,0.95,0.00021749672248386017,0,-0.5209847452581745,big,0.02,64,PRUNED
40,40,105.1797853,2024-04-15 01:54:11.492451,2024-04-15 04:06:38.558247,0 days 02:12:27.065796,2048,1000000,0.99,3.115055066215853e-05,0,0.5000062016087526,big,0.02,64,PRUNED
41,41,79.9201747,2024-04-15 01:54:23.984040,2024-04-15 03:22:28.504908,0 days 01:28:04.520868,128,10000,0.95,0.00015275590562838516,0,0.070975920795563,big,0.02,64,PRUNED
42,42,158.3178195,2024-04-15 02:17:38.041247,2024-04-15 03:22:53.658692,0 days 01:05:15.617445,32,1000000,0.95,1.5391659895887573e-05,0,-0.3892392482999729,big,0.02,8,COMPLETE
43,43,138.2280203,2024-04-15 02:30:57.717295,2024-04-15 03:36:01.212870,0 days 01:05:03.495575,1024,100000,0.9,0.016765994411131375,20000,-2.231822561806652,medium,0.01,32,COMPLETE
44,44,,2024-04-15 02:34:52.007099,2024-04-15 02:36:24.500211,0 days 00:01:32.493112,1024,100000,0.9,0.30607176332327374,20000,-1.8702215370552842,medium,0.08,512,PRUNED
45,45,123.1209071,2024-04-15 02:36:24.502206,2024-04-15 03:13:39.751227,0 days 00:37:15.249021,32,100000,0.995,0.0025486401712202706,20000,-3.4079739993884584,medium,0.02,128,PRUNED
46,46,117.2260515,2024-04-15 02:40:05.041912,2024-04-15 04:23:25.897385,0 days 01:43:20.855473,1024,100000,0.9,0.0005658445127130281,0,-3.3571490576987033,medium,0.02,1,PRUNED
47,47,148.5323715,2024-04-15 02:43:17.543851,2024-04-15 04:12:21.319829,0 days 01:29:03.775978,128,1000000,0.9999,1.3697621144241447e-05,0,0.651973006465438,big,0.02,64,COMPLETE
48,48,120.602396,2024-04-15 03:04:14.406389,2024-04-15 03:53:45.807289,0 days 00:49:31.400900,32,100000,0.9,0.001047550695193101,10000,-3.6950207330312947,medium,0.02,128,PRUNED
49,49,127.91655179999998,2024-04-15 03:13:39.752225,2024-04-15 04:17:36.590750,0 days 01:03:56.838525,1024,100000,0.98,0.0014429529771913677,20000,-3.431294154083945,medium,0.08,32,PRUNED
50,50,,2024-04-15 03:22:28.505905,2024-04-15 03:22:56.959861,0 days 00:00:28.453956,128,100000,0.9,0.17088462886013014,0,-1.8589421334277354,medium,0.08,32,PRUNED
51,51,133.3109665,2024-04-15 03:22:53.660685,2024-04-15 04:20:43.754209,0 days 00:57:50.093524,32,1000000,0.99,2.6674273933394813e-05,0,0.13245008355793175,medium,0.02,8,COMPLETE
52,52,129.8362504,2024-04-15 03:22:56.960858,2024-04-15 04:28:34.906429,0 days 01:05:37.945571,16,1000000,0.99,1.871836553691103e-05,0,-0.9400274555606016,big,0.001,8,PRUNED
53,53,116.90325370000001,2024-04-15 03:36:01.214864,2024-04-15 05:00:44.517012,0 days 01:24:43.302148,256,1000000,0.9999,1.3837032486613788e-05,0,0.2540879812099126,big,0.02,8,PRUNED
54,54,,2024-04-15 03:53:45.808286,2024-04-15 03:55:20.771335,0 days 00:01:34.963049,1024,100000,0.99,0.28942438262341064,20000,-2.0610870405961172,medium,0.01,32,PRUNED
55,55,108.2778112,2024-04-15 03:55:20.773330,2024-04-15 04:53:10.518283,0 days 00:57:49.744953,32,100000,0.95,0.0001331881934769907,1000,-0.7807190560868829,big,0.02,8,PRUNED
56,56,107.2933919,2024-04-15 04:06:38.559244,2024-04-15 05:03:23.002252,0 days 00:56:44.443008,32,1000000,0.95,3.199441341709686e-05,0,0.6737914250885038,big,0.05,8,PRUNED
57,57,127.65248649999998,2024-04-15 04:12:21.321823,2024-04-15 05:11:27.972898,0 days 00:59:06.651075,16,1000000,0.95,1.7657292101079622e-05,0,-0.23532958200124146,big,0.08,128,PRUNED
58,58,115.1685669,2024-04-15 04:17:36.591748,2024-04-15 05:29:41.566558,0 days 01:12:04.974810,128,1000000,0.9999,0.0004429430930611995,1000,0.7645515158139323,big,0.02,4,PRUNED
59,59,99.2684153,2024-04-15 04:20:43.756204,2024-04-15 05:18:16.746707,0 days 00:57:32.990503,128,1000000,0.999,2.826583673761236e-05,10000,0.2803073244565686,big,0.02,16,PRUNED
60,60,105.8788334,2024-04-15 04:23:25.898382,2024-04-15 05:23:46.655814,0 days 01:00:20.757432,32,100000,0.95,3.222329824182578e-05,0,0.3452815380151566,big,0.05,8,PRUNED
61,61,135.8725916,2024-04-15 04:28:34.907427,2024-04-15 05:41:31.907201,0 days 01:12:56.999774,128,1000000,0.9999,1.9513754916171815e-05,0,0.4507816099188068,big,0.02,1,COMPLETE
62,62,95.82607800000001,2024-04-15 04:53:10.519280,2024-04-15 05:30:06.148807,0 days 00:36:55.629527,32,1000000,0.95,0.00015404985865133145,20000,-0.05583586546923669,big,0.005,8,PRUNED
63,63,136.7381163,2024-04-15 05:00:44.519007,2024-04-15 05:51:38.705312,0 days 00:50:54.186305,32,1000000,0.999,0.00838505236129021,10000,-1.9390695533373945,medium,0.02,32,COMPLETE
64,64,150.4709929,2024-04-15 05:03:23.004247,2024-04-15 05:48:35.269808,0 days 00:45:12.265561,128,1000000,0.95,1.662141248116207e-05,20000,-1.5580712693609626,big,0.02,8,COMPLETE
65,65,100.4296306,2024-04-15 05:11:27.973896,2024-04-15 06:23:10.334073,0 days 01:11:42.360177,2048,100000,0.9,0.017930579449325374,20000,-2.3931324236360068,medium,0.01,32,PRUNED
66,66,136.12354090000002,2024-04-15 05:18:16.746707,2024-04-15 06:19:04.620747,0 days 01:00:47.874040,32,1000000,0.95,1.3166299184353628e-05,0,-2.4294753188038336,big,0.02,8,COMPLETE
67,67,158.5603992,2024-04-15 05:23:46.657809,2024-04-15 06:14:06.473220,0 days 00:50:19.815411,32,1000000,0.95,3.508327310366994e-05,10000,-0.4694094338368919,big,0.02,4,COMPLETE
68,68,116.50430639999999,2024-04-15 05:29:41.567556,2024-04-15 06:31:29.035086,0 days 01:01:47.467530,16,1000000,0.9,0.017334635744162535,1000,-2.0560492182214,medium,0.01,32,PRUNED
69,69,,2024-04-15 05:30:06.150802,2024-04-15 05:32:03.923904,0 days 00:01:57.773102,1024,10000,0.9,0.07063028290436783,10000,-2.375078624533212,medium,0.01,32,PRUNED
70,70,105.46491680000001,2024-04-15 05:32:03.924901,2024-04-15 06:14:40.518157,0 days 00:42:36.593256,1024,100000,0.9,0.0037753282664831057,20000,-2.424782651349936,small,0.01,32,PRUNED
71,71,139.1031375,2024-04-15 05:41:31.909195,2024-04-15 06:23:18.002623,0 days 00:41:46.093428,128,100000,0.9,0.0020066617330755723,20000,-1.8563600557185709,medium,0.01,64,COMPLETE
72,72,113.83774950000002,2024-04-15 05:48:35.271802,2024-04-15 06:33:34.169016,0 days 00:44:58.897214,128,1000000,0.99,3.5464909433215466e-05,20000,-1.9858701298906691,big,0.02,256,PRUNED
73,73,148.7334791,2024-04-15 05:51:38.706310,2024-04-15 07:03:30.152845,0 days 01:11:51.446535,128,1000000,0.999,1.638089923501421e-05,0,0.6242926324817373,big,0.005,64,COMPLETE
74,74,123.31453810000001,2024-04-15 06:14:06.474217,2024-04-15 06:57:15.886605,0 days 00:43:09.412388,128,1000000,0.95,1.8833151222792593e-05,20000,-1.7397287093236664,big,0.02,512,PRUNED
75,75,134.757238,2024-04-15 06:14:40.520152,2024-04-15 06:58:07.651204,0 days 00:43:27.131052,128,1000000,0.95,1.1731093098352363e-05,20000,-2.1836567921086774,big,0.02,256,COMPLETE
76,76,112.23421950000002,2024-04-15 06:19:04.622742,2024-04-15 07:06:41.219512,0 days 00:47:36.596770,32,1000000,0.98,6.901467087845246e-05,10000,0.6195005362941746,big,0.02,4,PRUNED
77,77,141.20868439999998,2024-04-15 06:23:10.335071,2024-04-15 07:06:06.873265,0 days 00:42:56.538194,128,1000000,0.95,3.494590171459626e-05,20000,-1.7699727922372308,big,0.02,512,COMPLETE
78,78,141.5489074,2024-04-15 06:23:18.005615,2024-04-15 07:01:01.414619,0 days 00:37:43.409004,128,100000,0.9,0.00015614566756574889,20000,-2.103388961479858,medium,0.01,64,COMPLETE
79,79,149.19568429999998,2024-04-15 06:31:29.036084,2024-04-15 07:19:27.707940,0 days 00:47:58.671856,32,1000000,0.995,9.386380038749046e-05,10000,-1.717944144652911,big,0.08,4,COMPLETE
80,80,112.44047040000001,2024-04-15 06:33:34.170014,2024-04-15 07:36:42.351810,0 days 01:03:08.181796,128,100000,0.95,0.0030549978206731066,1000,-2.795247654690478,medium,0.01,64,PRUNED
81,81,117.98479010000001,2024-04-15 06:57:15.887602,2024-04-15 07:44:08.490220,0 days 00:46:52.602618,32,1000000,0.95,7.93772064431612e-05,10000,-1.0892024313491226,big,0.001,64,PRUNED
82,82,86.0406918,2024-04-15 06:58:07.652201,2024-04-15 07:47:19.350673,0 days 00:49:11.698472,32,1000000,0.995,7.725654686616938e-05,10000,-1.0878731556605645,big,0.02,4,PRUNED
83,83,161.4746273,2024-04-15 07:01:01.415617,2024-04-15 07:48:12.859760,0 days 00:47:11.444143,32,1000000,0.95,4.538829137648965e-05,10000,-0.3991226205726439,big,0.01,4,COMPLETE
84,84,153.5026857,2024-04-15 07:03:30.154840,2024-04-15 08:30:21.075506,0 days 01:26:50.920666,512,1000000,0.999,3.662615929347543e-05,0,0.6770111869723805,big,0.005,256,COMPLETE
85,85,129.58251490000004,2024-04-15 07:06:06.874263,2024-04-15 08:17:30.592271,0 days 01:11:23.718008,128,1000000,0.98,6.482890334062432e-05,1000,0.45682199486098213,big,0.005,64,PRUNED
86,86,163.81623210000004,2024-04-15 07:06:41.219512,2024-04-15 08:03:14.334206,0 days 00:56:33.114694,32,1000000,0.9999,1.8174507771645913e-05,0,0.04806644376868485,big,0.005,64,COMPLETE
87,87,94.64507799999998,2024-04-15 07:19:27.708937,2024-04-15 08:44:13.996613,0 days 01:24:46.287676,512,1000000,0.999,0.00019056572002736766,0,0.622499858158547,big,0.005,64,PRUNED
88,88,134.1971944,2024-04-15 07:36:42.352807,2024-04-15 08:27:30.474419,0 days 00:50:48.121612,32,1000000,0.995,0.00019199518582306682,10000,-1.5886592389241223,big,0.001,4,PRUNED
89,89,67.5542083,2024-04-15 07:44:08.491218,2024-04-15 08:55:21.543123,0 days 01:11:13.051905,128,1000000,0.999,3.9957680497471886e-05,0,0.5118151036550278,big,0.005,64,PRUNED
90,90,111.754899,2024-04-15 07:47:19.351670,2024-04-15 08:25:37.769006,0 days 00:38:18.417336,32,1000000,0.98,0.00011221439125677604,20000,-1.6956694829267491,big,0.08,4,PRUNED
91,91,146.55698420000002,2024-04-15 07:48:12.860757,2024-04-15 08:37:17.233354,0 days 00:49:04.372597,16,1000000,0.995,0.0021623955804974237,10000,-2.007055337886456,big,0.08,4,COMPLETE
92,92,120.1935066,2024-04-15 08:03:14.335204,2024-04-15 08:45:58.618861,0 days 00:42:44.283657,128,1000000,0.9,1.0790947521790609e-05,20000,0.5215120369774744,big,0.005,64,PRUNED
93,93,132.8750054,2024-04-15 08:17:30.593269,2024-04-15 09:01:34.295468,0 days 00:44:03.702199,16,1000000,0.95,1.8983827158112543e-05,10000,-0.4104579717025056,big,0.01,4,PRUNED
94,94,95.77998170000001,2024-04-15 08:25:37.770003,2024-04-15 09:17:34.206986,0 days 00:51:56.436983,32,1000000,0.9999,9.060435044387676e-05,0,0.0820449494439267,big,0.005,64,PRUNED
95,95,93.80441259999999,2024-04-15 08:27:30.475416,2024-04-15 09:18:21.739960,0 days 00:50:51.264544,32,10000,0.9999,4.758099848850937e-05,0,0.3198605970545306,big,0.005,64,PRUNED
96,96,86.2518795,2024-04-15 08:30:21.076503,2024-04-15 09:25:00.074546,0 days 00:54:38.998043,128,1000000,0.999,0.0001336268686361969,0,0.27232419710153255,big,0.005,64,PRUNED
97,97,93.56657170000001,2024-04-15 08:37:17.234352,2024-04-15 09:23:51.093020,0 days 00:46:33.858668,32,1000000,0.9999,0.00024753955324752046,0,0.31369728539763997,big,0.005,64,PRUNED
98,98,187.0551763,2024-04-15 08:44:13.997610,2024-04-15 09:26:22.973056,0 days 00:42:08.975446,32,10000,0.9999,0.0002447432292946486,0,0.8881374739886176,big,0.005,64,COMPLETE
99,99,127.1155589,2024-04-15 08:45:58.619858,2024-04-15 09:26:12.457157,0 days 00:40:13.837299,32,1000000,0.9999,0.00010666189349599792,0,0.087243275090441,big,0.005,64,PRUNED
