,number,value,datetime_start,datetime_complete,duration,params_activation_fn,params_ent_coef,params_gae_lambda,params_gamma,params_learning_rate,params_log_std_init,params_lr_schedule,params_max_grad_norm,params_n_steps,params_net_arch,params_normalize_advantage,params_ortho_init,params_use_rms_prop,params_vf_coef,state
88,88,74.38845439999999,2024-04-15 12:37:05.174523,2024-04-15 12:53:36.378711,0 days 00:16:31.204188,relu,2.334208371357668e-08,0.8,0.9,0.0006629695870902243,0.10392421376732416,constant,0.5,16,small,False,False,True,0.010023189430861848,PRUNED
89,89,67.88711070000001,2024-04-15 12:38:00.495587,2024-04-15 12:57:15.295160,0 days 00:19:14.799573,relu,6.251459551648795e-07,0.8,0.9,0.00011638008864882143,-0.398280153175716,constant,0.5,8,small,False,True,True,0.2486354385976857,PRUNED
90,90,8.392900000000001,2024-04-15 12:39:29.597647,2024-04-15 12:53:25.672051,0 days 00:13:56.074404,relu,1.5209310794684456e-07,0.8,0.95,0.00014705496117288687,-0.5315737164156051,constant,0.9,512,small,False,False,True,0.2251721641063319,PRUNED
91,91,54.50377149999999,2024-04-15 12:41:20.800196,2024-04-15 12:56:33.947588,0 days 00:15:13.147392,relu,1.3777368967178171e-08,0.9,0.9,0.0002374515082769251,0.8158769947720637,constant,5.0,32,small,False,True,True,0.06679002166420098,PRUNED
92,92,56.0376526,2024-04-15 12:45:38.131701,2024-04-15 12:59:40.360294,0 days 00:14:02.228593,relu,6.848059437801524e-08,0.8,0.9,0.0012903305651349442,-0.006299980724231685,constant,0.5,512,small,False,True,True,0.16980650609174677,PRUNED
93,93,57.984726699999996,2024-04-15 12:45:44.891620,2024-04-15 13:01:09.826725,0 days 00:15:24.935105,relu,3.196968720949215e-08,0.8,0.9,0.01609657166053387,-0.5765396550859953,constant,0.5,32,small,False,True,True,0.18543375362911121,PRUNED
94,94,85.4963891,2024-04-15 12:47:27.497551,2024-04-15 13:02:20.837485,0 days 00:14:53.339934,relu,9.910788366368256e-06,0.9,0.9,0.0007377110805324758,-0.14147200719389902,constant,0.6,32,small,False,True,True,0.10691816994789252,COMPLETE
95,95,42.8981043,2024-04-15 12:53:25.673048,2024-04-15 13:05:42.229664,0 days 00:12:16.556616,relu,0.00012772868488660264,0.98,0.95,0.00019896625419869285,0.11011551858439375,constant,0.9,64,small,False,True,True,0.017486333459802716,PRUNED
96,96,65.33268819999999,2024-04-15 12:53:36.380705,2024-04-15 13:06:07.468027,0 days 00:12:31.087322,relu,6.959536621534304e-08,0.9,0.9,0.0012734621532977455,0.6683823275255258,constant,0.5,32,small,False,True,True,0.03752013394237886,PRUNED
97,97,65.412158,2024-04-15 12:55:07.609729,2024-04-15 13:06:11.185106,0 days 00:11:03.575377,relu,1.5095680678645826e-07,0.98,0.95,0.0039360614650371,0.4734749845592623,linear,0.9,128,small,False,True,True,0.11923057966274285,PRUNED
98,98,38.426237199999996,2024-04-15 12:56:33.948585,2024-04-15 13:06:33.797681,0 days 00:09:59.849096,relu,2.148334241821392e-07,0.9,0.9,5.164743572264951e-05,-0.7348524824982435,constant,0.5,64,small,True,True,True,0.007900887790845813,PRUNED
99,99,27.384779400000003,2024-04-15 12:57:15.297155,2024-04-15 13:06:36.596016,0 days 00:09:21.298861,relu,1.2589036726760562e-05,0.98,0.95,0.0013721066531850775,0.32688998567320826,constant,0.9,256,small,False,True,True,0.0007240536065558391,PRUNED
