,number,value,datetime_start,datetime_complete,duration,params_activation_fn,params_ent_coef,params_gae_lambda,params_gamma,params_learning_rate,params_log_std_init,params_lr_schedule,params_max_grad_norm,params_n_steps,params_net_arch,params_normalize_advantage,params_ortho_init,params_use_rms_prop,params_vf_coef,state
88,88,51.78568700000001,2024-04-18 01:00:14.179709,2024-04-18 01:15:56.249092,0 days 00:15:42.069383,relu,0.006516324018045728,0.98,0.9999,0.02895173048728106,-0.5212734796215772,linear,0.6,16,small,True,False,True,0.7241614526653743,PRUNED
89,89,55.9603328,2024-04-18 01:02:43.473527,2024-04-18 01:15:39.667708,0 days 00:12:56.194181,relu,0.00038511321038779716,0.98,0.9999,0.0010922539027976032,0.32931485229886814,linear,0.6,128,small,True,False,True,0.7412094941682386,PRUNED
90,90,41.15979610000001,2024-04-18 01:06:02.007189,2024-04-18 01:19:05.908264,0 days 00:13:03.901075,relu,2.2343028272670602e-08,0.98,0.995,0.014330294184326534,-1.4623671881641305,constant,0.3,512,medium,True,False,False,0.8851006707195893,PRUNED
91,91,2.9255246999999995,2024-04-18 01:06:34.942133,2024-04-18 01:24:55.090064,0 days 00:18:20.147931,relu,0.0002294087677559347,0.98,0.9999,0.0018167086454063265,0.7660455227418996,linear,0.6,8,small,True,False,True,0.5523157481364279,PRUNED
92,92,96.0780139,2024-04-18 01:07:22.316419,2024-04-18 01:20:51.726857,0 days 00:13:29.410438,relu,0.008406649894216307,0.98,0.9999,0.002114135715926631,-0.914572015363778,constant,0.6,64,medium,False,False,True,0.901607844760301,COMPLETE
93,93,7.896292,2024-04-18 01:11:53.045224,2024-04-18 01:25:10.060023,0 days 00:13:17.014799,relu,0.0002466206813092554,0.98,0.9999,0.030453402865932164,0.38318568905387057,linear,0.6,128,small,True,False,True,0.7293651081410928,PRUNED
94,94,13.248706799999999,2024-04-18 01:12:55.668746,2024-04-18 01:25:52.280094,0 days 00:12:56.611348,relu,0.008117998297677188,0.98,0.995,0.0011312684147207614,0.7180005814784747,linear,0.6,128,small,True,False,True,0.42096193095772483,PRUNED
95,95,39.037170100000004,2024-04-18 01:15:39.669702,2024-04-18 01:28:36.555933,0 days 00:12:56.886231,relu,0.02449097401066061,0.98,0.999,0.005279477923381754,0.12168844641023857,linear,0.7,16,small,True,False,True,0.5059927054979055,PRUNED
96,96,4.535964600000001,2024-04-18 01:15:56.250089,2024-04-18 01:27:56.450373,0 days 00:12:00.200284,tanh,1.2420815224545757e-08,0.92,0.995,0.07761326677370144,-1.3211579844941475,constant,5.0,128,medium,True,False,True,0.8994347100475456,PRUNED
97,97,-2.8468162,2024-04-18 01:16:52.480523,2024-04-18 01:29:33.922667,0 days 00:12:41.442144,relu,0.010461772014160407,0.98,0.99,3.433075841354627e-05,0.7368212444392633,linear,5.0,8,medium,False,False,True,0.4491125396417403,PRUNED
98,98,70.981644,2024-04-18 01:19:05.909262,2024-04-18 01:28:57.121010,0 days 00:09:51.211748,relu,0.0031452096350293476,0.95,0.999,0.0001008593129722431,-1.0304196895657143,constant,0.6,256,small,False,False,True,0.9869605876532732,COMPLETE
99,99,86.6813175,2024-04-18 01:20:51.728852,2024-04-18 01:29:25.400462,0 days 00:08:33.671610,relu,0.006275749295887542,0.92,0.995,0.0001805449705081547,-0.5747180994324387,linear,0.3,64,medium,False,True,True,0.8759891797423138,COMPLETE
