,number,value,datetime_start,datetime_complete,duration,params_activation_fn,params_ent_coef,params_gae_lambda,params_gamma,params_learning_rate,params_log_std_init,params_lr_schedule,params_max_grad_norm,params_n_steps,params_net_arch,params_normalize_advantage,params_ortho_init,params_use_rms_prop,params_vf_coef,state
88,88,50.576148599999996,2024-04-16 05:27:25.605149,2024-04-16 05:43:04.355696,0 days 00:15:38.750547,relu,1.4981574707219526e-08,0.92,0.99,0.007428121916733784,-2.5796545216090094,linear,0.7,128,medium,False,True,True,0.32465698587907355,PRUNED
89,89,13.898378499999998,2024-04-16 05:29:18.597920,2024-04-16 05:44:37.068711,0 days 00:15:18.470791,relu,9.669602138687227e-08,0.9,0.95,0.031710299038835384,-0.8318521533504365,linear,1.0,128,medium,False,True,False,0.1113763208939097,PRUNED
90,90,12.8298755,2024-04-16 05:31:01.428872,2024-04-16 05:46:07.805181,0 days 00:15:06.376309,relu,1.4121633104443407e-07,0.92,0.95,0.01608996388700833,-1.7809198029357725,linear,2.0,128,medium,False,False,True,0.2014850738208823,PRUNED
91,91,4.675618399999999,2024-04-16 05:31:24.427357,2024-04-16 05:46:48.027689,0 days 00:15:23.600332,relu,4.507447814577789e-08,0.92,0.99,0.057706973606162504,-1.6645023569217563,linear,2.0,128,medium,True,True,True,0.4117410095653359,PRUNED
92,92,123.8404311,2024-04-16 05:32:39.059099,2024-04-16 05:48:03.825004,0 days 00:15:24.765905,tanh,0.00013253493224398756,0.92,0.99,2.8187551043154547e-05,0.6156227670205844,constant,0.8,64,small,True,False,False,0.0635040942517748,PRUNED
93,93,161.50676209999997,2024-04-16 05:33:07.286598,2024-04-16 05:48:53.872802,0 days 00:15:46.586204,tanh,0.0005999094988901981,0.92,0.999,1.6133587474477796e-05,0.33836956090174775,constant,0.8,64,medium,True,False,True,0.06362507576352879,COMPLETE
94,94,119.78600019999999,2024-04-16 05:35:57.858445,2024-04-16 05:50:32.334468,0 days 00:14:34.476023,tanh,0.007379257712195214,0.98,0.995,3.305727927559261e-05,-0.48375524705741946,constant,0.8,64,small,True,False,True,0.010949808011247258,PRUNED
95,95,7.904124499999999,2024-04-16 05:41:33.501709,2024-04-16 05:54:03.505105,0 days 00:12:30.003396,relu,1.522873949663476e-08,0.92,0.95,0.7973409467681101,-0.4289358975225217,linear,0.6,128,medium,False,True,False,0.2194279627381308,PRUNED
96,96,15.904651600000003,2024-04-16 05:43:04.356694,2024-04-16 05:54:42.123206,0 days 00:11:37.766512,relu,2.0384417961008224e-05,0.92,0.999,0.02314598776801705,0.17584628630225263,linear,2.0,128,small,False,True,True,0.17321749663025465,PRUNED
97,97,16.006948099999995,2024-04-16 05:44:37.069708,2024-04-16 05:55:12.715938,0 days 00:10:35.646230,relu,1.3036270047607384e-08,0.92,0.995,0.269791277368667,-1.7373637127517145,linear,2.0,128,medium,False,True,True,0.24951432722277647,PRUNED
98,98,125.3671155,2024-04-16 05:46:07.806179,2024-04-16 05:55:46.487468,0 days 00:09:38.681289,relu,7.390421008388222e-05,0.92,0.95,0.00022024696418138705,-1.493823030860093,constant,0.3,32,medium,True,False,True,0.10523774084393041,PRUNED
99,99,130.3183244,2024-04-16 05:46:48.027689,2024-04-16 05:55:48.957860,0 days 00:09:00.930171,relu,2.188497334096652e-05,0.8,0.95,0.00013497581886174056,0.7669762065023975,constant,0.5,64,medium,True,False,True,0.017458089592300108,PRUNED
