,number,value,datetime_start,datetime_complete,duration,params_activation_fn,params_ent_coef,params_gae_lambda,params_gamma,params_learning_rate,params_log_std_init,params_lr_schedule,params_max_grad_norm,params_n_steps,params_net_arch,params_normalize_advantage,params_ortho_init,params_use_rms_prop,params_vf_coef,state
89,89,7.098363599999999,2024-04-18 03:59:37.584909,2024-04-18 04:14:34.181950,0 days 00:14:56.597041,relu,0.0048243628618520416,0.95,0.95,0.08138825045915228,0.34429181923028673,linear,5.0,32,medium,True,True,True,0.06141299595902898,PRUNED
90,90,105.86815869999998,2024-04-18 04:00:57.886123,2024-04-18 04:15:58.207203,0 days 00:15:00.321080,relu,0.0980352045813554,1.0,0.95,0.0019437716876443336,-0.11387089799825072,linear,0.9,32,medium,True,True,False,0.2278964097114146,PRUNED
91,91,52.9091356,2024-04-18 04:01:41.662804,2024-04-18 04:16:27.431483,0 days 00:14:45.768679,relu,0.01816493058757611,0.9,0.95,0.03582517263199365,-0.8590960102465277,linear,0.7,32,medium,True,True,True,0.3034165658785839,PRUNED
92,92,46.1107224,2024-04-18 04:04:03.385039,2024-04-18 04:18:43.366541,0 days 00:14:39.981502,relu,0.0065804894143136694,1.0,0.995,0.02091353330480453,0.8234906635902449,linear,5.0,32,medium,True,True,True,0.09509280673381579,PRUNED
93,93,74.07297679999999,2024-04-18 04:04:37.421999,2024-04-18 04:17:46.842160,0 days 00:13:09.420161,tanh,0.0002603909835477279,0.9,0.995,0.13668520383528326,0.9364996718615624,linear,1.0,1024,small,False,True,False,0.04338241795555478,PRUNED
94,94,12.7830932,2024-04-18 04:08:04.006435,2024-04-18 04:21:36.850560,0 days 00:13:32.844125,relu,0.02872105445761753,0.99,0.95,0.06443234136571936,-0.5870239130484795,linear,5.0,32,medium,True,True,True,0.13459646930456698,PRUNED
95,95,5.2828053,2024-04-18 04:09:31.157328,2024-04-18 04:22:28.569507,0 days 00:12:57.412179,relu,0.008798052174332372,0.8,0.95,0.1210787494989243,-0.2608735907449508,linear,0.8,32,medium,True,True,True,0.008130987501846841,PRUNED
96,96,124.21805859999999,2024-04-18 04:10:47.588892,2024-04-18 04:23:10.212795,0 days 00:12:22.623903,relu,0.015227550152525497,1.0,0.95,0.0018182916648804303,-1.0533379414357,linear,5.0,32,medium,True,True,True,0.5573508309883484,PRUNED
97,97,4.890355399999999,2024-04-18 04:14:34.182947,2024-04-18 04:24:06.372924,0 days 00:09:32.189977,tanh,0.0014236781126857284,0.8,0.995,0.11992257526130914,0.41182969771073064,linear,1.0,1024,medium,False,True,False,0.2025821976551938,PRUNED
98,98,5.0048919,2024-04-18 04:15:58.208200,2024-04-18 04:24:33.428479,0 days 00:08:35.220279,relu,0.015461830641498534,1.0,0.95,0.020783583892522793,-0.17604732664346967,linear,0.5,32,small,True,True,True,0.18216094139394437,PRUNED
99,99,3.1962716999999996,2024-04-18 04:16:27.432480,2024-04-18 04:24:29.253970,0 days 00:08:01.821490,tanh,0.0012816082655145629,1.0,0.999,0.023185803454825106,-1.9110369891257357,linear,5.0,256,medium,True,True,True,0.12800727770500978,PRUNED
